{
  "case_id": "obras_avenida80",
  "description": "Metro de la 80 works: two lanes closed on Avenida 80 from 7:00 to 17:00, detour via Carrera 76 and Calle 33.",
  "decision": "APPROVE_WITH_CONDITIONS",
  "decision_rule": "D3",
  "decision_reason": "There are HIGH alerts, but they can be mitigated; the mitigations become conditions.",
  "alerts": [
    {
      "level": "HIGH",
      "code": "TRANSIT_ACCESS_LOST",
      "rule": "R04",
      "because": "The closure removes a Metroplús or feeder bus stop and there is no alternative stop within 300 m.",
      "evidence": {
        "closure.removes_transit_stop": true,
        "transit.alt_stop_within_300m": false
      },
      "where": "Carrera 76 with Calle 33"
    },
    {
      "level": "HIGH",
      "code": "SCHOOL_SAFETY",
      "rule": "R01",
      "because": "Heavy detour traffic near a school at entry or exit time raises child pedestrian risk.",
      "evidence": {
        "detour.passes_school_zone": true,
        "time.school_peak": true,
        "detour.heavy_vehicles": true
      },
      "where": "Carrera 76 with Calle 33"
    },
    {
      "level": "MEDIUM",
      "code": "TRANSIT_DELAY",
      "rule": "R05",
      "because": "The detour adds more than 10 minutes to a bus route on the corridor.",
      "evidence": {
        "transit.added_minutes": 12
      },
      "where": "Carrera 76 with Calle 33"
    }
  ],
  "recommendations": [
    "Install a temporary bus stop within 300 m",
    "Coordinate a temporary route change with the bus operator",
    "Ban heavy vehicles on the detour during school entry and exit"
  ],
  "questions_asked": [
    {
      "fact": "detour.heavy_vehicles",
      "question": "Will heavy vehicles (trucks, buses) use the detour?",
      "answer": true
    }
  ],
  "open_questions": [],
  "fired_rules": [
    "R04",
    "R05",
    "R11",
    "R01"
  ],
  "trace": [
    "R04 fired (Transit stop removed without alternative): closure.removes_transit_stop == True (is True), transit.alt_stop_within_300m == False (is False)",
    "  R04 asserted conflict.transit_access = True",
    "R05 fired (Bus route delay): transit.added_minutes > 10 (is 12)",
    "R11 fired (Mitigation available for high alerts): alerts.high_count >= 1 (is 1), mitigation.available == True (is True)",
    "  R11 asserted mitigation.possible = True",
    "Asked detour.heavy_vehicles for R01: True",
    "R01 fired (School zone at school hours): detour.passes_school_zone == True (is True), time.school_peak == True (is True), detour.heavy_vehicles == True (is True)",
    "  R01 asserted conflict.school_safety = True",
    "R02 not fired: detour.bike_lane == 'shared' (is 'separated') is false",
    "R03 not fired: intersection.high_crash_history == True (is False) is false",
    "R06 not fired: event.massive == True (is False) is false",
    "R07 not fired: event.exit_crowd > 20000 (is 0) is false",
    "R08 not fired: detour.removes_loading_zones == True (is False) is false",
    "R09 not fired: detour.blocks_hospital_access == True (is False) is false",
    "R10 not fired: detour.residential_night_minutes > 60 (is 0) is false",
    "R12 not fired: detour.single_hotspot == True (is False) is false"
  ]
}